[
  {
    "id": "synthesia",
    "name": "Synthesia",
    "website": "https://www.synthesia.io",
    "founded_year": 2017,
    "description": "Enterprise-grade generative video platform utilizing AI avatars.",
    "long_description": "Synthesia enables the creation of photorealistic AI avatars that can speak in over 120 languages, addressing the high cost and logistical friction of traditional video production. Used by over 60% of Fortune 100 companies for training and corporate communications.",
    "industries": ["Generative AI", "Video Production", "Enterprise Software"],
    "technologies": ["Deep Learning", "Synthetic Media", "Computer Vision"],
    "headquarters": {
      "city": "London",
      "country_code": "GB"
    },
    "funding": {
      "total_raised_usd": 180000000,
      "last_round": "Series D",
      "investors": ["NEA", "Accel"]
    }
  },
  {
    "id": "stability-ai",
    "name": "Stability AI",
    "website": "https://stability.ai",
    "founded_year": 2020,
    "description": "Open-source foundational model provider for creative media.",
    "long_description": "A leader in the foundational model layer, Stability AI is known for Stable Diffusion, an open-source text-to-image generator. The company focuses on the convergence of generative AI and studio content across audio, video, and 3D modalities.",
    "industries": ["Generative AI", "Infrastructure", "Creative Arts"],
    "technologies": ["Foundation Models", "Open Source", "Diffusion Models"],
    "headquarters": {
      "city": "London",
      "country_code": "GB",
      "region": "Notting Hill"
    },
    "funding": {
      "total_raised_usd": 80000000,
      "last_round": "Venture",
      "investors": ["Greycroft", "Coatue", "Sean Parker"]
    },
    "open_source": {
      "active": true
    }
  },
  {
    "id": "elevenlabs",
    "name": "ElevenLabs",
    "website": "https://elevenlabs.io",
    "founded_year": 2022,
    "description": "Advanced AI voice synthesis and audio intelligence platform.",
    "long_description": "ElevenLabs specializes in high-fidelity voice synthesis that captures emotional intonation and context. It has achieved unicorn status and serves as a platform for a growing cluster of audio-centric AI applications.",
    "industries": ["Generative AI", "Audio Technology"],
    "technologies": ["Voice Synthesis", "Natural Language Processing"],
    "headquarters": {
      "city": "London",
      "country_code": "GB"
    },
    "funding": {
      "last_round": "Series B",
      "investors": ["Andreessen Horowitz"]
    }
  },
  {
    "id": "wayve",
    "name": "Wayve",
    "website": "https://wayve.ai",
    "founded_year": 2017,
    "description": "Pioneer of AV2.0 end-to-end deep learning for autonomous vehicles.",
    "long_description": "Wayve employs end-to-end deep learning to train foundation models for driving, eschewing HD maps and rule-based coding. Their technology learns to perceive and act from raw video data, allowing it to generalize to new environments.",
    "industries": ["Autonomous Vehicles", "Embodied AI", "Transport"],
    "technologies": ["End-to-End Deep Learning", "Computer Vision", "Reinforcement Learning"],
    "headquarters": {
      "city": "London",
      "country_code": "GB"
    },
    "funding": {
      "total_raised_usd": 1050000000,
      "last_round": "Series C",
      "investors": ["SoftBank", "NVIDIA", "Microsoft"]
    }
  },
  {
    "id": "dexory",
    "name": "Dexory",
    "website": "https://www.dexory.com",
    "founded_year": 2015,
    "description": "Real-time warehouse intelligence using autonomous robots and digital twins.",
    "long_description": "Dexory combines autonomous mobile robots with a digital twin platform, DexoryView, to provide real-time visibility into inventory and operations, addressing critical supply chain inefficiencies.",
    "industries": ["Logistics", "Robotics", "Supply Chain"],
    "technologies": ["Autonomous Mobile Robots (AMRs)", "Digital Twins", "Predictive Analytics"],
    "headquarters": {
      "city": "London",
      "country_code": "GB"
    },
    "funding": {
      "total_raised_usd": 165000000,
      "last_round": "Series C",
      "investors": ["Eurazeo"]
    }
  },
  {
    "id": "quantexa",
    "name": "Quantexa",
    "website": "https://www.quantexa.com",
    "founded_year": 2016,
    "description": "Contextual Decision Intelligence platform for risk and compliance.",
    "long_description": "Quantexa specializes in Entity Resolution, connecting disparate data points to detect fraud and financial crime. Their platform serves banking, insurance, and public sector clients globally.",
    "industries": ["FinTech", "Risk Management", "Decision Intelligence"],
    "technologies": ["Entity Resolution", "Big Data Analytics", "Network Analysis"],
    "headquarters": {
      "city": "London",
      "country_code": "GB"
    },
    "funding": {
      "total_raised_usd": 175000000,
      "last_round": "Series F",
      "investors": ["Teachers' Venture Growth"]
    }
  },
  {
    "id": "isomorphic-labs",
    "name": "Isomorphic Labs",
    "website": "https://www.isomorphiclabs.com",
    "founded_year": 2021,
    "description": "AI-driven drug discovery and biological modeling.",
    "long_description": "A subsidiary of Alphabet, Isomorphic Labs uses AI to model biological phenomena and design novel molecules, building on the breakthroughs of AlphaFold to revolutionize the pharmaceutical industry.",
    "industries": ["Life Sciences", "HealthTech", "Biotech"],
    "technologies": ["Biological Modeling", "Deep Learning", "Computational Chemistry"],
    "headquarters": {
      "city": "London",
      "country_code": "GB"
    },
    "funding": {
      "total_raised_usd": 600000000,
      "last_round": "Series B",
      "investors": ["Alphabet", "Andreessen Horowitz"]
    }
  },
  {
    "id": "tessl",
    "name": "Tessl",
    "website": "https://tessl.io",
    "founded_year": 2024,
    "description": "AI-native software development platform.",
    "long_description": "Tessl is pioneering 'spec-centric' development where developers define intent and specifications, while AI agents handle implementation and maintenance, aiming for a paradigm shift in software engineering.",
    "industries": ["Developer Tools", "Software Engineering"],
    "technologies": ["AI Agents", "Automated Coding"],
    "headquarters": {
      "city": "London",
      "country_code": "GB"
    },
    "funding": {
      "total_raised_usd": 125000000,
      "last_round": "Series A",
      "investors": ["Index Ventures"]
    }
  },
  {
    "id": "polyai",
    "name": "PolyAI",
    "website": "https://poly.ai",
    "founded_year": 2017,
    "description": "Superhuman voice assistants for enterprise customer service.",
    "long_description": "PolyAI develops voice agents that handle complex, multi-turn conversations for high-volume environments like hospitality and logistics, resolving over 50% of calls without human intervention.",
    "industries": ["Customer Service", "Enterprise Software"],
    "technologies": ["Conversational AI", "Spoken Language Understanding"],
    "headquarters": {
      "city": "London",
      "country_code": "GB"
    },
    "funding": {
      "total_raised_usd": 86000000,
      "last_round": "Series D",
      "investors": ["Georgian", "Khosla Ventures"]
    }
  },
  {
    "id": "xapien",
    "name": "Xapien",
    "website": "https://xapien.com",
    "founded_year": 2018,
    "description": "Automated due diligence and background research platform.",
    "long_description": "Xapien uses AI and NLP to automate deep-dive research for legal and wealth management sectors, scuring millions of records to produce due diligence reports in minutes.",
    "industries": ["LegalTech", "Risk Management", "Compliance"],
    "technologies": ["Natural Language Processing", "Automated Research"],
    "headquarters": {
      "city": "London",
      "country_code": "GB"
    },
    "funding": {
      "total_raised_usd": 10000000,
      "last_round": "Series A"
    }
  }
]