[
  {
    "id": "nebius-group",
    "name": "Nebius Group",
    "website": "https://nebius.com",
    "founded_year": 2023,
    "description": "A dedicated AI cloud provider building hyperscale-grade GPU infrastructure.",
    "long_description": "Headquartered in Amsterdam and listed on NASDAQ, Nebius is an infrastructure-focused AI cloud provider. They design proprietary server architecture and manage large-scale clusters optimized for LLM training and inference, positioning themselves as a GDPR-compliant alternative to US hyperscalers.",
    "industries": ["Cloud Infrastructure", "Deep Tech"],
    "technologies": ["GPU Cloud", "LLM", "HPC", "Kubernetes"],
    "headquarters": {
      "city": "Amsterdam",
      "country_code": "NL",
      "region": "North Holland"
    },
    "funding": {
      "total_raised_usd": 1700000000,
      "last_round": "Post-IPO Equity",
      "investors": ["NVIDIA", "Accel"]
    },
    "open_source": {
      "active": true,
      "github_org": "https://github.com/nebius",
      "huggingface_org": "https://huggingface.co/nebius"
    }
  },
  {
    "id": "weaviate",
    "name": "Weaviate",
    "website": "https://weaviate.io",
    "founded_year": 2019,
    "description": "An open-source vector database enabling AI-powered search and RAG applications.",
    "long_description": "Weaviate is a leading vector database that allows developers to build scalable AI applications. It stores data as vector embeddings, enabling semantic search and Retrieval-Augmented Generation (RAG). Its modular architecture allows integration with various machine learning models.",
    "industries": ["Infrastructure", "SaaS", "Developer Tools"],
    "technologies": ["Vector Database", "RAG", "Machine Learning"],
    "headquarters": {
      "city": "Amsterdam",
      "country_code": "NL",
      "region": "North Holland"
    },
    "funding": {
      "total_raised_usd": 67000000,
      "last_round": "Series B",
      "investors": ["Index Ventures", "Battery Ventures"]
    },
    "open_source": {
      "active": true,
      "github_org": "https://github.com/weaviate",
      "huggingface_org": "https://huggingface.co/weaviate"
    }
  },
  {
    "id": "datasnipper",
    "name": "DataSnipper",
    "website": "https://www.datasnipper.com",
    "founded_year": 2017,
    "description": "An intelligent automation platform for audit and finance professionals.",
    "long_description": "DataSnipper embeds AI directly into Excel to automate the 'vouching and tracing' process in auditing. It reconciles unstructured documents against ledgers, creating a verified audit trail. It is used by all of the Big Four accounting firms.",
    "industries": ["FinTech", "Audit", "Enterprise Software"],
    "technologies": ["Intelligent Automation", "OCR", "Document AI"],
    "headquarters": {
      "city": "Amsterdam",
      "country_code": "NL",
      "region": "North Holland"
    },
    "funding": {
      "total_raised_usd": 100000000,
      "last_round": "Series B",
      "investors": ["Index Ventures", "Insight Partners"]
    }
  },
  {
    "id": "axelera-ai",
    "name": "Axelera AI",
    "website": "https://www.axelera.ai",
    "founded_year": 2021,
    "description": "Semiconductor company designing energy-efficient AI hardware for edge computing.",
    "long_description": "Based in Eindhoven, Axelera AI develops the Metis AI platform using in-memory computing to provide high-performance AI inference with low power consumption. Their Europa AIPU is designed for edge devices like drones and robots.",
    "industries": ["Semiconductors", "Deep Tech", "Hardware"],
    "technologies": ["In-Memory Computing", "Edge AI", "Computer Vision"],
    "headquarters": {
      "city": "Eindhoven",
      "country_code": "NL",
      "region": "North Brabant"
    },
    "funding": {
      "total_raised_usd": 68000000,
      "last_round": "Series B",
      "investors": ["Samsung Catalyst Fund"]
    },
    "open_source": {
      "active": true,
      "github_org": "https://github.com/axelera-ai"
    }
  },
  {
    "id": "mews",
    "name": "Mews",
    "website": "https://www.mews.com",
    "founded_year": 2012,
    "description": "Cloud-native hospitality system leveraging autonomous AI agents.",
    "long_description": "Mews provides a property management system for the hospitality industry. In 2025, it pivoted to an AI-first strategy, launching autonomous agents that manage revenue, guest requests, and housekeeping without human oversight.",
    "industries": ["Hospitality", "SaaS", "PropTech"],
    "technologies": ["Agentic AI", "Autonomous Agents", "Predictive Analytics"],
    "headquarters": {
      "city": "Amsterdam",
      "country_code": "NL",
      "region": "North Holland"
    },
    "funding": {
      "total_raised_usd": 410000000,
      "last_round": "Series D"
    }
  },
  {
    "id": "cradle",
    "name": "Cradle",
    "website": "https://www.cradle.bio",
    "founded_year": 2021,
    "description": "Biotech startup using generative AI to design improved proteins.",
    "long_description": "Cradle uses Large Language Models to predict amino acid sequences in proteins, allowing biologists to program proteins with specific properties like heat resistance. It bridges digital design and wet-lab validation.",
    "industries": ["Biotechnology", "HealthTech", "Life Sciences"],
    "technologies": ["Generative Biology", "LLM", "Protein Engineering"],
    "headquarters": {
      "city": "Amsterdam",
      "country_code": "NL",
      "region": "North Holland"
    },
    "funding": {
      "total_raised_usd": 100000000,
      "last_round": "Series B",
      "investors": ["Index Ventures", "IVP", "Kindred Capital"]
    }
  },
  {
    "id": "source-ag",
    "name": "Source.ag",
    "website": "https://www.source.ag",
    "founded_year": 2020,
    "description": "AgTech company developing AI models to optimize greenhouse agriculture.",
    "long_description": "Source.ag creates digital twins of greenhouses to simulate plant biology and climate conditions. Their 'AI Grower' platform optimizes resource usage and maximizes yield for sustainable food production.",
    "industries": ["AgTech", "Sustainability", "FoodTech"],
    "technologies": ["Digital Twins", "Predictive Analytics", "Simulation"],
    "headquarters": {
      "city": "Amsterdam",
      "country_code": "NL",
      "region": "North Holland"
    },
    "funding": {
      "total_raised_usd": 60000000,
      "last_round": "Series B"
    }
  },
  {
    "id": "marvelx",
    "name": "MarvelX",
    "website": "https://marvelx.ai",
    "founded_year": 2023,
    "description": "Agentic AI platform automating complex workflows for the insurance industry.",
    "long_description": "MarvelX builds an agentic AI backbone for insurance, employing intelligent agents to automate claims processing and other operational workflows that traditionally require manual reasoning.",
    "industries": ["InsurTech", "FinTech"],
    "technologies": ["Agentic AI", "Process Automation"],
    "headquarters": {
      "city": "Amsterdam",
      "country_code": "NL",
      "region": "North Holland"
    },
    "funding": {
      "total_raised_usd": 6000000,
      "last_round": "Seed",
      "investors": ["EQT Ventures"]
    }
  },
  {
    "id": "nearfield-instruments",
    "name": "Nearfield Instruments",
    "website": "https://www.nearfieldinstruments.com",
    "founded_year": 2016,
    "description": "Atomic-scale 3D metrology solutions for the semiconductor industry.",
    "long_description": "A spin-off from TNO, Nearfield Instruments develops high-throughput Scanning Probe Microscopy (SPM) for non-destructive, atom-scale 3D measurement of complex chip structures.",
    "industries": ["Semiconductors", "Deep Tech", "Metrology"],
    "technologies": ["Scanning Probe Microscopy", "Atomic-scale Metrology"],
    "headquarters": {
      "city": "Rotterdam",
      "country_code": "NL",
      "region": "South Holland"
    },
    "funding": {
      "total_raised_usd": 169000000,
      "last_round": "Series C"
    }
  },
  {
    "id": "overstory",
    "name": "Overstory",
    "website": "https://www.overstory.com",
    "founded_year": 2018,
    "description": "Vegetation intelligence platform using satellite data and AI.",
    "long_description": "Overstory applies AI to satellite imagery to monitor vegetation near power lines. This helps electric utilities prevent wildfires and outages by identifying high-risk areas globally.",
    "industries": ["ClimateTech", "Energy", "Infrastructure"],
    "technologies": ["Computer Vision", "Remote Sensing", "Predictive Analytics"],
    "headquarters": {
      "city": "Amsterdam",
      "country_code": "NL",
      "region": "North Holland"
    },
    "funding": {
      "total_raised_usd": 57000000,
      "last_round": "Series B"
    },
    "open_source": {
      "active": true,
      "github_org": "https://github.com/20treeAI"
    }
  }
]